{
  "$schema": "http://json-schema.org/draft-07/schema#",
  "$id": "https://github.com/us-llc-fees-dataset/compliance-rules/schema/state.schema.json",
  "title": "LLC annual-compliance penalties, per jurisdiction",
  "description": "v2 (2026-08-11, E11) - the pruned consumer-facing contract. Records the late-fee shape for an LLC's recurring periodic obligation, how long delinquency runs before administrative dissolution, and the reinstatement fee after it. Deliberately minimal: one flat amount or one monthly rate, no penalty matrices, no interest tables, no long-form legal reasoning - the fields carry what a state page renders, evidence carries one sentence per value, and everything else lives in git history. This namespace is authoritative for these values.",
  "type": "object",
  "additionalProperties": false,
  "required": [
    "stateName",
    "stateAbbr",
    "stateSlug",
    "compliance",
    "notes",
    "needsReview",
    "lastVerified"
  ],
  "properties": {
    "stateName": { "type": "string", "minLength": 2 },
    "stateAbbr": { "type": "string", "pattern": "^[A-Z]{2}$" },
    "stateSlug": { "type": "string", "pattern": "^[a-z0-9-]+$" },

    "compliance": {
      "type": "object",
      "additionalProperties": false,
      "required": [
        "lateFeeUsd",
        "lateFeeRatePercentPerMonth",
        "lateFeeBasis",
        "reinstatementFeeUsd",
        "reinstatementNote",
        "administrativeDissolutionAfterDays",
        "administrativeDissolutionAfterMonths",
        "evidence"
      ],
      "properties": {
        "lateFeeUsd": {
          "type": ["number", "null"],
          "minimum": 0,
          "description": "Flat late fee in USD. null when the state uses a rate or publishes none."
        },
        "lateFeeRatePercentPerMonth": {
          "type": ["number", "null"],
          "minimum": 0,
          "maximum": 100,
          "description": "Monthly percentage or interest rate. The only rate field, by design: no interest tables, no compounding schedules."
        },
        "lateFeeBasis": {
          "oneOf": [
            { "type": "null" },
            { "enum": ["flat", "percentage", "interest", "mixed", "none", "unpublished"] }
          ],
          "description": "What the state actually publishes. mixed means more than one shape applies; the dominant figure goes in the fields and the rest in notes. A none requires the agency's own publication (form, fee schedule, FAQ) as evidence - statute silence alone never grounds it (E12)."
        },
        "reinstatementFeeUsd": {
          "type": ["number", "null"],
          "minimum": 0,
          "description": "The fee to reinstate after administrative dissolution, including any per-year component folded in; reinstatementNote says how. Read the agency's reinstatement form and fee schedule before concluding null (E12)."
        },
        "reinstatementNote": {
          "type": ["string", "null"],
          "maxLength": 300,
          "description": "One short sentence: what reinstatement requires, such as delinquent reports, per-year fees, or a time window."
        },
        "administrativeDissolutionAfterDays": {
          "type": ["integer", "null"],
          "minimum": 0,
          "description": "How long a delinquent LLC may stay delinquent before the state may administratively dissolve or revoke it, when the publisher states that interval in days. null when the publisher states it in months, or states none."
        },
        "administrativeDissolutionAfterMonths": {
          "type": ["integer", "null"],
          "minimum": 0,
          "description": "The same interval when the publisher states it in months or years (years x 12). At most one of the two fields is populated, and it is the unit the publisher used: converting months to days is inference, not data. notes names what the interval runs from - the due date, a notice, or a second missed report."
        },
        "evidence": { "$ref": "#/definitions/evidenceList" }
      }
    },

    "notes": {
      "type": "string",
      "maxLength": 350,
      "description": "One to two sentences only: the recurring obligation and its period, plus the single nuance the fields cannot carry without lying (what the dissolution clock runs from, a calendar-date dissolution, the E10 mixed shape). Legal reasoning stays in git history, not here."
    },
    "needsReview": {
      "type": ["string", "null"],
      "description": "What is missing and what would settle it."
    },
    "lastVerified": {
      "type": "string",
      "pattern": "^\\d{4}-\\d{2}-\\d{2}$",
      "description": "The date the cited pages were retrieved and every quoted passage was mechanically confirmed to occur in them."
    }
  },

  "definitions": {
    "evidence": {
      "type": "object",
      "additionalProperties": false,
      "required": ["quote", "url"],
      "properties": {
        "quote": {
          "type": "string",
          "minLength": 20,
          "maxLength": 300,
          "description": "One contiguous verbatim passage carrying the figure or ruling, copied from the page as retrieved, artefacts included. Never assembled across an ellipsis, never taken from a search snippet, never tidied."
        },
        "url": { "type": "string", "pattern": "^https?://" },
        "supports": {
          "type": "string",
          "description": "Which value in the enclosing object this passage grounds, by field name (lateFeeUsd, reinstatementFeeUsd, ...). A record carrying several passages is only honest if each one says what it is evidence for."
        }
      }
    },
    "evidenceList": {
      "type": "array",
      "minItems": 1,
      "items": { "$ref": "#/definitions/evidence" }
    }
  }
}
